{
  "$id": "https://frog-game-v2.local/schemas/map-theme/import-approval-v1.schema.json",
  "$schema": "https://json-schema.org/draft/2020-12/schema",
  "type": "object",
  "additionalProperties": false,
  "required": ["schemaVersion", "approvalId", "packageId", "revisionId", "mappingApprovalHash", "packageContentHash", "validationReportHash", "reviewEvidenceHash", "acceptedDeviationIds", "approvedBy", "approvedAt"],
  "properties": {
    "schemaVersion": { "const": 1 },
    "approvalId": { "$ref": "common-v1.schema.json#/$defs/id" },
    "packageId": { "$ref": "common-v1.schema.json#/$defs/id" },
    "revisionId": { "$ref": "common-v1.schema.json#/$defs/id" },
    "mappingApprovalHash": { "$ref": "common-v1.schema.json#/$defs/hash" },
    "packageContentHash": { "$ref": "common-v1.schema.json#/$defs/hash" },
    "validationReportHash": { "$ref": "common-v1.schema.json#/$defs/hash" },
    "reviewEvidenceHash": { "$ref": "common-v1.schema.json#/$defs/hash" },
    "acceptedDeviationIds": {
      "type": "array",
      "uniqueItems": true,
      "items": { "$ref": "common-v1.schema.json#/$defs/id" }
    },
    "approvedBy": { "type": "string", "minLength": 1 },
    "approvedAt": { "type": "string", "format": "date-time" }
  }
}
